{
  "schemaVersion": "1.1.0",
  "schemaUrl": "https://ahasignals.com/data/benchmarks/pit-backtest-validation/v1.1/schema.json",
  "submissionSchemaUrl": "https://ahasignals.com/data/benchmarks/pit-backtest-validation/v1.1/submission-schema.json",
  "artifact": {
    "id": "ahasignals-financial-ai-pit-integrity-benchmark-v1-1",
    "title": "AhaSignals Financial AI Point-in-Time Integrity Benchmark",
    "version": "1.1.0",
    "canonicalUrl": "https://ahasignals.com/research/point-in-time-backtest-validation-benchmark/",
    "repositoryUrl": "https://github.com/AhaSignals/pit-backtest-validation-benchmark",
    "publishedAt": "2026-09-04",
    "status": "release-candidate",
    "versionDoi": null,
    "conceptDoi": "10.5281/zenodo.22279743",
    "conceptDoiUrl": "https://doi.org/10.5281/zenodo.22279743",
    "dataLicense": "CC BY 4.0",
    "softwareLicense": "MIT",
    "creator": "AhaSignals"
  },
  "researchQuestion": "Can a financial AI system avoid using SEC information that did not exist at the stated decision time?",
  "design": {
    "evaluationMode": "open-book deterministic conformance suite",
    "tracks": [
      {
        "trackId": "retrieval",
        "name": "Evidence-restricted retrieval",
        "purpose": "Tests whether a system selects and cites the admissible evidence from the supplied source bundle.",
        "evidencePolicy": "Use only the sourceEvidence records supplied with the case. Do not use outside knowledge."
      },
      {
        "trackId": "knowledge-contamination",
        "name": "Knowledge-contamination control",
        "purpose": "Tests whether a system avoids importing later-known values when answering an explicitly historical question.",
        "evidencePolicy": "The system may have broader internal knowledge, but every answer and citation must obey the decision-time cutoff."
      }
    ],
    "sourceClock": "SEC acceptance timestamp",
    "answerPolicy": "Select evidence by decision time before extracting, comparing or calculating a value.",
    "abstentionPolicy": "When an issuer has withdrawn reliance and no restated value is yet public, the only admissible numeric answer is no answer.",
    "noLeaderboardClaim": "The reference run validates the fixtures and scorer. It is not a claim about any third-party model or agent."
  },
  "scope": {
    "caseCount": 8,
    "promptCount": 16,
    "issuerCount": 5,
    "primaryFailureFamilies": [
      "later comparative overwrite",
      "evidence-state transition",
      "fiscal-period mismatch",
      "formal restatement and non-reliance"
    ],
    "excludedClaims": [
      "factor alpha",
      "information coefficient",
      "portfolio return",
      "Sharpe ratio",
      "drawdown",
      "general model intelligence"
    ]
  },
  "sourceResearchObjects": [
    {
      "title": "Point-in-Time Backtest Validation Benchmark v1.0.0",
      "relation": "isNewVersionOf",
      "url": "https://doi.org/10.5281/zenodo.22279744"
    },
    {
      "title": "CoreWeave later-comparatives case study",
      "relation": "isDerivedFrom",
      "url": "https://doi.org/10.5281/zenodo.22288550"
    },
    {
      "title": "BigBear.ai accession-level PIT revision ledger",
      "relation": "isDerivedFrom",
      "url": "https://doi.org/10.5281/zenodo.22288546"
    }
  ],
  "cases": [
    {
      "caseId": "AS-PIT-001",
      "compatibility": {
        "introducedIn": "1.0.0",
        "sourceCaseId": "AS-PIT-001"
      },
      "title": "Do not import a later CoreWeave comparative into an earlier decision",
      "issuer": {
        "company": "CoreWeave, Inc.",
        "ticker": "CRWV",
        "cik": "0001769628"
      },
      "failureMode": "later-comparative-backfill",
      "decisionTime": "2025-08-13T13:30:00.000Z",
      "task": "Return the CoreWeave Q2 2025 revenue value available at the decision time and cite the SEC accession that made it public.",
      "expected": {
        "responseStatus": "answered",
        "answer": 1212788000,
        "answerUnit": "USD",
        "citedAccessions": [
          "0001769628-25-000041"
        ],
        "evidenceIds": [
          "crwv:revenue-2025-04-01-2025-06-30:v1"
        ],
        "knowledgeState": "first-reported"
      },
      "forbiddenFuture": {
        "answers": [
          1212000000
        ],
        "accessions": [
          "0001769628-26-000366"
        ],
        "evidenceIds": [
          "crwv:revenue-2025-04-01-2025-06-30:v2"
        ],
        "acceptedAt": "2026-08-11T23:24:42.000Z"
      },
      "sourceEvidence": [
        {
          "role": "eligible",
          "accession": "0001769628-25-000041",
          "acceptedAt": "2025-08-12T22:18:48.000Z",
          "url": "https://www.sec.gov/Archives/edgar/data/1769628/000176962825000041/crwv-20250630.htm"
        },
        {
          "role": "future-comparative",
          "accession": "0001769628-26-000366",
          "acceptedAt": "2026-08-11T23:24:42.000Z",
          "url": "https://www.sec.gov/Archives/edgar/data/1769628/000176962826000366/crwv-20260630.htm"
        }
      ],
      "abstentionRule": "Do not abstain: an eligible first-reported value exists.",
      "passRule": "Select the latest source vintage whose SEC acceptance timestamp is on or before the decision time. The August 2026 comparative is excluded."
    },
    {
      "caseId": "AS-PIT-002",
      "compatibility": {
        "introducedIn": "1.0.0",
        "sourceCaseId": "AS-PIT-002"
      },
      "title": "Keep a later CoreWeave sign change outside the earlier information set",
      "issuer": {
        "company": "CoreWeave, Inc.",
        "ticker": "CRWV",
        "cik": "0001769628"
      },
      "failureMode": "later-presentation-sign-flip",
      "decisionTime": "2025-08-13T13:30:00.000Z",
      "task": "Return the sign of CoreWeave other investing activities available at the decision time and cite the controlling accession.",
      "expected": {
        "responseStatus": "answered",
        "answer": {
          "value": 26109000,
          "sign": "positive"
        },
        "answerUnit": "USD",
        "citedAccessions": [
          "0001769628-25-000041"
        ],
        "evidenceIds": [
          "crwv:other-investing-h1-2025:v1"
        ],
        "knowledgeState": "first-reported"
      },
      "forbiddenFuture": {
        "answers": [
          {
            "value": -6000000,
            "sign": "negative"
          }
        ],
        "accessions": [
          "0001769628-26-000366"
        ],
        "evidenceIds": [
          "crwv:other-investing-h1-2025:v2"
        ],
        "acceptedAt": "2026-08-11T23:24:42Z"
      },
      "sourceEvidence": [
        {
          "role": "eligible",
          "accession": "0001769628-25-000041",
          "acceptedAt": "2025-08-12T22:18:48Z",
          "url": "https://www.sec.gov/Archives/edgar/data/1769628/000176962825000041/crwv-20250630.htm"
        },
        {
          "role": "future-comparative",
          "accession": "0001769628-26-000366",
          "acceptedAt": "2026-08-11T23:24:42Z",
          "url": "https://www.sec.gov/Archives/edgar/data/1769628/000176962826000366/crwv-20260630.htm"
        }
      ],
      "abstentionRule": "Do not abstain: an eligible first-reported value exists.",
      "passRule": "The earlier positive value remains active until the later filing is accepted; a sign flip in a later comparative cannot be backfilled."
    },
    {
      "caseId": "AS-PIT-003",
      "compatibility": {
        "introducedIn": "1.0.0",
        "sourceCaseId": "AS-PIT-003"
      },
      "title": "Do not represent preliminary evidence as a completed filing",
      "issuer": {
        "company": "Super Micro Computer, Inc.",
        "ticker": "SMCI",
        "cik": "0001375365"
      },
      "failureMode": "preliminary-to-filed-eligibility",
      "decisionTime": "2026-08-29T00:00:00.000Z",
      "task": "Classify the issuer evidence state and primary-matrix eligibility at the decision time.",
      "expected": {
        "responseStatus": "answered",
        "answer": {
          "sourceStatus": "preliminary",
          "primaryMatrixEligible": false
        },
        "answerUnit": null,
        "citedAccessions": [
          "0001375365-26-000021"
        ],
        "evidenceIds": [
          "ai-infrastructure-cross-section-2026-08-31-v1"
        ],
        "knowledgeState": "preliminary"
      },
      "forbiddenFuture": {
        "answers": [
          {
            "sourceStatus": "filed",
            "primaryMatrixEligible": true
          }
        ],
        "accessions": [
          "0001375365-26-000022"
        ],
        "evidenceIds": [
          "ai-infrastructure-cross-section-2026-09-01-v2"
        ],
        "acceptedAt": "2026-08-31T14:21:23.000Z"
      },
      "sourceEvidence": [
        {
          "role": "eligible-preliminary",
          "accession": "0001375365-26-000021",
          "acceptedAt": "2026-08-11T20:06:16.000Z",
          "url": "https://www.sec.gov/Archives/edgar/data/1375365/000137536526000021/exhibit991_20260630.htm"
        },
        {
          "role": "future-completed-filing",
          "accession": "0001375365-26-000022",
          "acceptedAt": "2026-08-31T14:21:23.000Z",
          "url": "https://www.sec.gov/Archives/edgar/data/1375365/000137536526000022/smci-20260630.htm"
        }
      ],
      "abstentionRule": "Do not invent completed-filing status. The correct answer is the preliminary state.",
      "passRule": "Before the completed filing, retain the preliminary source status and exclusion from the primary filed-company matrix."
    },
    {
      "caseId": "AS-PIT-004",
      "compatibility": {
        "introducedIn": "1.0.0",
        "sourceCaseId": "AS-PIT-004"
      },
      "title": "Report a provenance upgrade even when the derived value is unchanged",
      "issuer": {
        "company": "Super Micro Computer, Inc.",
        "ticker": "SMCI",
        "cik": "0001375365"
      },